{
  "version": 1,
  "name": "Sample trace",
  "description": "A minimal sample trace for local development.",
  "entry": {
    "file": "src/extension.ts",
    "line": 13
  },
  "steps": [
    {
      "id": "step-1",
      "file": "src/extension.ts",
      "line": 95,
      "title": "Enter openTrace",
      "summary": "Enter openTrace() and begin loading the selected trace file.",
      "depth": 0,
      "kind": "enter",
      "next": "step-2",
      "range": {
        "startLine": 95,
        "endLine": 109
      }
    },
    {
      "id": "step-2",
      "file": "src/extension.ts",
      "line": 102,
      "title": "Call parseTraceFile",
      "summary": "openTrace() calls parseTraceFile(traceUri) before it can update the UI.",
      "depth": 0,
      "kind": "call",
      "next": "step-3",
      "range": {
        "startLine": 102,
        "endLine": 102,
        "startColumn": 31,
        "endColumn": 45
      }
    },
    {
      "id": "step-3",
      "file": "src/trace/parser.ts",
      "line": 6,
      "title": "Enter parseTraceFile",
      "summary": "Enter parseTraceFile() and read, parse, and validate the JSON trace document.",
      "depth": 1,
      "parentStepId": "step-1",
      "kind": "enter",
      "next": "step-4",
      "range": {
        "startLine": 6,
        "endLine": 15
      }
    },
    {
      "id": "step-4",
      "file": "src/trace/parser.ts",
      "line": 15,
      "title": "Return from parseTraceFile",
      "summary": "parseTraceFile() finishes and returns the parsed trace document to its caller.",
      "depth": 1,
      "parentStepId": "step-1",
      "kind": "return",
      "next": "step-5",
      "range": {
        "startLine": 12,
        "endLine": 15
      }
    },
    {
      "id": "step-5",
      "file": "src/extension.ts",
      "line": 102,
      "title": "Resume at the same parseTraceFile call site",
      "summary": "After parseTraceFile() returns, the flow comes back to the same await parseTraceFile(traceUri) line in openTrace().",
      "depth": 0,
      "parentStepId": "step-1",
      "kind": "resume",
      "next": "step-6",
      "range": {
        "startLine": 102,
        "endLine": 102,
        "startColumn": 31,
        "endColumn": 45
      }
    },
    {
      "id": "step-6",
      "file": "src/extension.ts",
      "line": 104,
      "title": "Call updateUi",
      "summary": "openTrace() calls updateUi() after the parsed trace has been stored.",
      "depth": 0,
      "kind": "call",
      "next": "step-7",
      "range": {
        "startLine": 104,
        "endLine": 104,
        "startColumn": 13,
        "endColumn": 21
      }
    },
    {
      "id": "step-7",
      "file": "src/extension.ts",
      "line": 32,
      "title": "Enter updateUi",
      "summary": "Enter updateUi() and refresh the editor highlight and panel state for the current step.",
      "depth": 1,
      "parentStepId": "step-1",
      "kind": "enter",
      "next": "step-8",
      "range": {
        "startLine": 32,
        "endLine": 93
      }
    },
    {
      "id": "step-8",
      "file": "src/extension.ts",
      "line": 93,
      "title": "Return from updateUi",
      "summary": "updateUi() finishes and returns control to openTrace().",
      "depth": 1,
      "parentStepId": "step-1",
      "kind": "return",
      "next": "step-9",
      "range": {
        "startLine": 53,
        "endLine": 93
      }
    },
    {
      "id": "step-9",
      "file": "src/extension.ts",
      "line": 104,
      "title": "Resume at the same updateUi call site",
      "summary": "After updateUi() returns, the flow comes back to the same await updateUi() line in openTrace() before moving below it.",
      "depth": 0,
      "parentStepId": "step-1",
      "kind": "resume",
      "range": {
        "startLine": 104,
        "endLine": 104,
        "startColumn": 13,
        "endColumn": 21
      }
    }
  ]
}
